Instruction,Response
Article 30 of Indian Constitution,"Right of minorities to establish and administer educational institutions
(1) All minorities, whether based on religion or language, shall have the right to establish and administer educational institutions of their choice
(1A) In making any law providing for the compulsory acquisition of any property of an educational institution established and administered by a minority, referred to in clause ( 1 ), the State shall ensure that the amount fixed by or determined under such law for the acquisition of such property is such as would not restrict or abrogate the right guaranteed under that clause
(2) The state shall not, in granting aid to educational institutions, discriminate against any educational institution on the ground that it is under the management of a minority, whether based on religion or language""
Article 31A of Indian Constitution,""Saving of laws providing for acquisition of estates, etc ( 1 ) Notwithstanding anything contained in Article 13, no law providing for
(a) the acquisition by the State of any estate or of any rights therein or the extinguishment or modification of any such rights, or
(b) the taking over of the management of any property by the State for a limited period either in the public interest or in order to secure the proper management of the property, or
(c) the amalgamation of two or more corporations either in the public interest or in order to secure the proper management of any of the corporations, or
(d) the extinguishment or modification of any rights of managing agents, secretaries and treasurers, managing directors, directors or managers of corporations, or of any voting rights of shareholders thereof, or
(e) the extinguishment or modification of any rights accruing by virtue of any agreement, lease or licence for the purpose of searching for, or winning, any mineral or mineral oil, or the premature termination or cancellation of any such agreement, lease or licence, shall be deemed to be void on the ground that it is inconsistent with, or takes away or abridges any of the rights conferred by Article 14 or Article 19: Provided that where such law is a law made by the Legislature of a State, the provisions of this article shall not apply thereto unless such law, having been reserved for the consideration of the President, has received his assent: Provided further that where any law makes any provision for the acquisition by the State of any estate and where any land comprised therein is held by a person under his personal cultivation, it shall not be lawful for the State to acquire any portion of such land as is within the ceiling limit applicable to him under any law for the time being in force or any building or structure standing thereon or appurtenant thereto, unless the law relating to the acquisition of such land, building or structure, provides for payment of compensation at a rate which shall not be less than the market value thereof"",""Below is an instruction that describes a task or a question. Write a response that appropriately completes the request."
Article 31A of Indian Constitution,"Saving of laws providing for acquisition of estates, etc ( 1 ) Notwithstanding anything contained in Article 13, no law providing for
(a) the acquisition by the State of any estate or of any rights therein or the extinguishment or modification of any such rights, or
(b) the taking over of the management of any property by the State for a limited period either in the public interest or in order to secure the proper management of the property, or
(c) the amalgamation of two or more corporations either in the public interest or in order to secure the proper management of any of the corporations, or
(d) the extinguishment or modification of any rights of managing agents, secretaries and treasurers, managing directors, directors or managers of corporations, or of any voting rights of shareholders thereof, or
(e) the extinguishment or modification of any rights accruing by virtue of any agreement, lease or licence for the purpose of searching for, or winning, any mineral or mineral oil, or the premature termination or cancellation of any such agreement, lease or licence, shall be deemed to be void on the ground that it is inconsistent with, or takes away or abridges any of the rights conferred by Article 14 or Article 19: Provided that where such law is a law made by the Legislature of a State, the provisions of this article shall not apply thereto unless such law, having been reserved for the consideration of the President, has received his assent: Provided further that where any law makes any provision for the acquisition by the State of any estate and where any land comprised therein is held by a person under his personal cultivation, it shall not be lawful for the State to acquire any portion of such land as is within the ceiling limit applicable to him under any law for the time being in force or any building or structure standing thereon or appurtenant thereto, unless the law relating to the acquisition of such land, building or structure, provides for payment of compensation at a rate which shall not be less than the market value thereof""
Article 31B of Indian Constitution,""Validation of certain Acts and Regulations Without prejudice to the generality of the provisions contained in Article 31A, none of the Acts and Regulations specified in the Ninth Schedule nor any of the provisions thereof shall be deemed to be void, or ever to have become void, on the ground that such Act, Regulation or provision is inconsistent with, or takes away or abridges any of the rights conferred by, any provisions of this Part, and notwithstanding any judgment, decree or order of any court or tribunal to the contrary, each of the said Acts and Regulations shall, subject to the power of any competent Legislature to repeal or amend it, continue in force"",""Below is an instruction that describes a task or a question. Write a response that appropriately completes the request."
Article 31B of Indian Constitution,"Validation of certain Acts and Regulations Without prejudice to the generality of the provisions contained in Article 31A, none of the Acts and Regulations specified in the Ninth Schedule nor any of the provisions thereof shall be deemed to be void, or ever to have become void, on the ground that such Act, Regulation or provision is inconsistent with, or takes away or abridges any of the rights conferred by, any provisions of this Part, and notwithstanding any judgment, decree or order of any court or tribunal to the contrary, each of the said Acts and Regulations shall, subject to the power of any competent Legislature to repeal or amend it, continue in force""
Article 31C of Indian Constitution,""Saving of laws giving effect to certain directive principles Notwithstanding anything contained in Article 13, no law giving effect to the policy of the State towards securing all or any of the principles laid down in Part IV shall be deemed to be void on the ground that it is inconsistent with, or takes away or abridges any of the rights conferred by Article 14 or Article 19 and no law containing a declaration that it is for giving effect to such policy shall be called in question in any court on the ground that it does not give effect to such policy: Provided that where such law is made by the Legislature of a State, the provisions of this Article shall not apply thereto unless such law, having been reserved for the consideration of the President, has received his assent Right to Constitutional Remedies"",""Below is an instruction that describes a task or a question. Write a response that appropriately completes the request."
Article 31C of Indian Constitution,"Saving of laws giving effect to certain directive principles Notwithstanding anything contained in Article 13, no law giving effect to the policy of the State towards securing all or any of the principles laid down in Part IV shall be deemed to be void on the ground that it is inconsistent with, or takes away or abridges any of the rights conferred by Article 14 or Article 19 and no law containing a declaration that it is for giving effect to such policy shall be called in question in any court on the ground that it does not give effect to such policy: Provided that where such law is made by the Legislature of a State, the provisions of this Article shall not apply thereto unless such law, having been reserved for the consideration of the President, has received his assent Right to Constitutional Remedies""
Article 32 of Indian Constitution,""Remedies for enforcement of rights conferred by this Part
(1) The right to move the Supreme Court by appropriate proceedings for the enforcement of the rights conferred by this Part is guaranteed
(2) The Supreme Court shall have power to issue directions or orders or writs, including writs in the nature of habeas corpus, mandamus, prohibition, quo warranto and certiorari, whichever may be appropriate, for the enforcement of any of the rights conferred by this Part
(3) Without prejudice to the powers conferred on the Supreme Court by clause ( 1 ) and ( 2 ), Parliament may by law empower any other court to exercise within the local limits of its jurisdiction all or any of the powers exercisable by the Supreme Court under clause ( 2 )
(4) The right guaranteed by this article shall not be suspended except as otherwise provided for by this Constitution"",""Below is an instruction that describes a task or a question. Write a response that appropriately completes the request."
Article 32 of Indian Constitution,"Remedies for enforcement of rights conferred by this Part
(1) The right to move the Supreme Court by appropriate proceedings for the enforcement of the rights conferred by this Part is guaranteed
(2) The Supreme Court shall have power to issue directions or orders or writs, including writs in the nature of habeas corpus, mandamus, prohibition, quo warranto and certiorari, whichever may be appropriate, for the enforcement of any of the rights conferred by this Part
(3) Without prejudice to the powers conferred on the Supreme Court by clause ( 1 ) and ( 2 ), Parliament may by law empower any other court to exercise within the local limits of its jurisdiction all or any of the powers exercisable by the Supreme Court under clause ( 2 )
(4) The right guaranteed by this article shall not be suspended except as otherwise provided for by this Constitution""
Article 33 of Indian Constitution,""Power of Parliament to modify the rights conferred by this Part in their application etc Parliament may, by law, determine to what extent any of the rights conferred by this Part shall, in their application to,
(a) the members of the Armed Forces; or
(b) the members of the Forces charged with the maintenance of public order; or
(c) persons employed in any bureau or other organisation established by the State for purposes of intelligence or counter intelligence; or
(d) persons employed in, or in connection with, the telecommunication systems set up for the purposes of any Force, bureau or organisation referred to in clauses (a) to (c), be restricted or abrogated so as to ensure the proper discharge of their duties and the maintenance of discipline among them"",""Below is an instruction that describes a task or a question. Write a response that appropriately completes the request."
Article 33 of Indian Constitution,"Power of Parliament to modify the rights conferred by this Part in their application etc Parliament may, by law, determine to what extent any of the rights conferred by this Part shall, in their application to,
(a) the members of the Armed Forces; or
(b) the members of the Forces charged with the maintenance of public order; or
(c) persons employed in any bureau or other organisation established by the State for purposes of intelligence or counter intelligence; or
(d) persons employed in, or in connection with, the telecommunication systems set up for the purposes of any Force, bureau or organisation referred to in clauses (a) to (c), be restricted or abrogated so as to ensure the proper discharge of their duties and the maintenance of discipline among them""
Article 34 of Indian Constitution,""Restriction on rights conferred by this Part while martial law is in force in any area Notwithstanding anything in the foregoing provisions of this Part, Parliament may by law indemnify any person in the service of the Union or of a State or any other person in respect of any act done by him in connection with the maintenance or restoration of order in any area within the territory of India where martial law was in force or validate any sentence passed, punishment inflicted, forfeiture ordered or other act done under martial law in such area"",""Below is an instruction that describes a task or a question. Write a response that appropriately completes the request."
Article 34 of Indian Constitution,"Restriction on rights conferred by this Part while martial law is in force in any area Notwithstanding anything in the foregoing provisions of this Part, Parliament may by law indemnify any person in the service of the Union or of a State or any other person in respect of any act done by him in connection with the maintenance or restoration of order in any area within the territory of India where martial law was in force or validate any sentence passed, punishment inflicted, forfeiture ordered or other act done under martial law in such area""
Article 35 of Indian Constitution,""Legislation to give effect to the provisions of this Part Notwithstanding anything in this Constitution,
(a) Parliament shall have, and the Legislature of a State shall not have, power to make laws
(i) with respect to any of the matters which under clause ( 3 ) of Article 16, clause ( 3 ) of Article 32, Article 33 and Article 34 may be provided for by law made by Parliament; and
(ii) for prescribing punishment for those acts which are declared to be offences under this Part; and Parliament shall, as soon as may be after the commencement of this Constitution, make laws for prescribing punishment for the acts referred to in sub clause (ii);
(b) any law in force immediately before the commencement of this Constitution in the territory of India with respect to any of the matters referred to in sub clause (i) of clause (a) or providing for punishment for any act referred to in sub clause (ii) of that clause shall, subject to the terms there of and to any adaptations and modifications that may be made therein under Article 372, continue in force until altered or repealed or amended by Parliament Explanation In this article, the expression law in force has the same meaning as in Article 372 PART IV DIRECTIVE PRINCIPLES OF STATE POLICY"",""Below is an instruction that describes a task or a question. Write a response that appropriately completes the request."
Article 35 of Indian Constitution,"Legislation to give effect to the provisions of this Part Notwithstanding anything in this Constitution,
(a) Parliament shall have, and the Legislature of a State shall not have, power to make laws
(i) with respect to any of the matters which under clause ( 3 ) of Article 16, clause ( 3 ) of Article 32, Article 33 and Article 34 may be provided for by law made by Parliament; and
(ii) for prescribing punishment for those acts which are declared to be offences under this Part; and Parliament shall, as soon as may be after the commencement of this Constitution, make laws for prescribing punishment for the acts referred to in sub clause (ii);
(b) any law in force immediately before the commencement of this Constitution in the territory of India with respect to any of the matters referred to in sub clause (i) of clause (a) or providing for punishment for any act referred to in sub clause (ii) of that clause shall, subject to the terms there of and to any adaptations and modifications that may be made therein under Article 372, continue in force until altered or repealed or amended by Parliament Explanation In this article, the expression law in force has the same meaning as in Article 372 PART IV DIRECTIVE PRINCIPLES OF STATE POLICY""
Article 36 of Indian Constitution,""Definition In this Part, unless the context otherwise requires, the State has the same meaning as in Part III"",""Below is an instruction that describes a task or a question. Write a response that appropriately completes the request."
Article 36 of Indian Constitution,"Definition In this Part, unless the context otherwise requires, the State has the same meaning as in Part III""
Article 37 of Indian Constitution,""Application of the principles contained in this Part The provisions contained in this Part shall not be enforceable by any court, but the principles therein laid down are nevertheless fundamental in the governance of the country and it shall be the duty of the State to apply these principles in making laws"",""Below is an instruction that describes a task or a question. Write a response that appropriately completes the request."
Article 37 of Indian Constitution,"Application of the principles contained in this Part The provisions contained in this Part shall not be enforceable by any court, but the principles therein laid down are nevertheless fundamental in the governance of the country and it shall be the duty of the State to apply these principles in making laws""
Article 38 of Indian Constitution,""State to secure a social order for the promotion of welfare of the people
(1) The State shall strive to promote the welfare of the people by securing and protecting as effectively as it may a social order in which justice, social, economic and political, shall inform all the institutions of the national life
(2) The State shall, in particular, strive to minimize the inequalities in income, and endeavor to eliminate inequalities in status, facilities and opportunities, not only amongst individuals but also amongst groups of people residing in different areas or engaged in different vocations"",""Below is an instruction that describes a task or a question. Write a response that appropriately completes the request."
Article 38 of Indian Constitution,"State to secure a social order for the promotion of welfare of the people
(1) The State shall strive to promote the welfare of the people by securing and protecting as effectively as it may a social order in which justice, social, economic and political, shall inform all the institutions of the national life
(2) The State shall, in particular, strive to minimize the inequalities in income, and endeavor to eliminate inequalities in status, facilities and opportunities, not only amongst individuals but also amongst groups of people residing in different areas or engaged in different vocations""
Article 39 of Indian Constitution,""Certain principles of policy to be followed by the State: The State shall, in particular, direct its policy towards securing
(a) that the citizens, men and women equally, have the right to an adequate means to livelihood;
(b) that the ownership and control of the material resources of the community are so distributed as best to subserve the common good;
(c) that the operation of the economic system does not result in the concentration of wealth and means of production to the common detriment;
(d) that there is equal pay for equal work for both men and women;
(e) that the health and strength of workers, men and women, and the tender age of children are not abused and that citizens are not forced by economic necessity to enter avocations unsuited to their age or strength;
(f) that children are given opportunities and facilities to develop in a healthy manner and in conditions of freedom and dignity and that childhood and youth are protected against exploitation and against moral and material abandonment"",""Below is an instruction that describes a task or a question. Write a response that appropriately completes the request."
Article 39 of Indian Constitution,"Certain principles of policy to be followed by the State: The State shall, in particular, direct its policy towards securing
(a) that the citizens, men and women equally, have the right to an adequate means to livelihood;
(b) that the ownership and control of the material resources of the community are so distributed as best to subserve the common good;
(c) that the operation of the economic system does not result in the concentration of wealth and means of production to the common detriment;
(d) that there is equal pay for equal work for both men and women;
(e) that the health and strength of workers, men and women, and the tender age of children are not abused and that citizens are not forced by economic necessity to enter avocations unsuited to their age or strength;
(f) that children are given opportunities and facilities to develop in a healthy manner and in conditions of freedom and dignity and that childhood and youth are protected against exploitation and against moral and material abandonment""
Article 39A of Indian Constitution,""Equal justice and free legal aid The State shall secure that the operation of the legal system promotes justice, on a basis of equal opportunity, and shall, in particular, provide free legal aid, by suitable legislation or schemes or in any other way, to ensure that opportunities for securing justice are not denied to any citizen by reason of economic or other disabilities"",""Below is an instruction that describes a task or a question. Write a response that appropriately completes the request."
Article 39A of Indian Constitution,"Equal justice and free legal aid The State shall secure that the operation of the legal system promotes justice, on a basis of equal opportunity, and shall, in particular, provide free legal aid, by suitable legislation or schemes or in any other way, to ensure that opportunities for securing justice are not denied to any citizen by reason of economic or other disabilities""
Article 40 of Indian Constitution,Organisation of village panchayats The State shall take steps to organize village panchayats and endow them with such powers and authority as may be necessary to enable them to function as units of self government,""Below is an instruction that describes a task or a question. Write a response that appropriately completes the request."
Article 40 of Indian Constitution,"Organisation of village panchayats The State shall take steps to organize village panchayats and endow them with such powers and authority as may be necessary to enable them to function as units of self government""
Article 41 of Indian Constitution,""Right to work, to education and to public assistance in certain cases The State shall, within the limits of its economic capacity and development, make effective provision for securing the right to work, to education and to public assistance in cases of unemployment, old age, sickness and disablement, and in other cases of undeserved want"",""Below is an instruction that describes a task or a question. Write a response that appropriately completes the request."
Article 41 of Indian Constitution,"Right to work, to education and to public assistance in certain cases The State shall, within the limits of its economic capacity and development, make effective provision for securing the right to work, to education and to public assistance in cases of unemployment, old age, sickness and disablement, and in other cases of undeserved want""
Article 42 of Indian Constitution,Provision for just and humane conditions of work and maternity relief The State shall make provision for securing just and humane conditions of work and for maternity relief,""Below is an instruction that describes a task or a question. Write a response that appropriately completes the request."
Article 42 of Indian Constitution,"Provision for just and humane conditions of work and maternity relief The State shall make provision for securing just and humane conditions of work and for maternity relief""
Article 43 of Indian Constitution,""Living wage, etc, for workers The State shall endeavour to secure, by suitable legislation or economic organisation or in any other way, to all workers, agricultural, industrial or otherwise, work, a living wage, conditions of work ensuring a decent standard of life and full enjoyment of leisure and social and cultural opportunities and, in particular, the State shall endeavour to promote cottage industries on an individual or co operative basis in rural areas"",""Below is an instruction that describes a task or a question. Write a response that appropriately completes the request."
Article 43 of Indian Constitution,"Living wage, etc, for workers The State shall endeavour to secure, by suitable legislation or economic organisation or in any other way, to all workers, agricultural, industrial or otherwise, work, a living wage, conditions of work ensuring a decent standard of life and full enjoyment of leisure and social and cultural opportunities and, in particular, the State shall endeavour to promote cottage industries on an individual or co operative basis in rural areas""
Article 43A of Indian Constitution,""Participation of workers in management of industries The State shall take steps, by suitable legislation or in any other way, to secure the participation of workers in the management of undertakings, establishments or other organisations engaged in any industry"",""Below is an instruction that describes a task or a question. Write a response that appropriately completes the request."
